id;industry;recommended_sections;color_schemes;content_guidelines;cta_examples;recommended_forms;created_at;updated_at
fc00160a-8c12-4553-a067-d27b4b3ba41e;auto_detailing;"[""hero"",""services"",""before_after_gallery"",""pricing"",""testimonials"",""booking_form"",""contact""]";[];Focus on visual transformation, emphasize convenience of mobile service, highlight quality products used;"[""Book Your Detail Today"",""Get a Free Quote"",""Schedule Now"",""See Our Work""]";"[""booking_form"",""quote_request"",""contact_form""]";2025-11-11 21:46:38.235489+00;2025-11-11 21:46:38.235489+00
2612b95e-da97-4d9b-9181-dfdef3aa7eac;restaurant;"[""hero"",""menu"",""gallery"",""about"",""reservations"",""location"",""contact""]";[];Showcase food photography, emphasize unique dishes, highlight ambiance and experience;"[""Reserve a Table"",""Order Online"",""View Menu"",""Book Now""]";"[""reservation_form"",""contact_form"",""newsletter_signup""]";2025-11-11 21:46:38.235489+00;2025-11-11 21:46:38.235489+00
165c45d6-1e45-4a8a-a54c-c45e5f4810bf;fitness;"[""hero"",""classes"",""trainers"",""pricing"",""testimonials"",""free_trial"",""contact""]";[];Emphasize transformation stories, community aspect, expert trainers, results-driven;"[""Start Free Trial"",""Join Now"",""Book a Class"",""Meet Our Trainers""]";"[""trial_signup"",""class_booking"",""contact_form""]";2025-11-11 21:46:38.235489+00;2025-11-11 21:46:38.235489+00
87ce0f10-e589-45f6-8c58-3208154fce80;legal;"[""hero"",""practice_areas"",""about"",""attorney_profiles"",""testimonials"",""consultation"",""contact""]";[];Build trust and authority, showcase expertise, emphasize results and experience;"[""Free Consultation"",""Contact Us"",""Get Legal Help"",""Schedule a Meeting""]";"[""consultation_request"",""contact_form"",""case_evaluation""]";2025-11-11 21:46:38.235489+00;2025-11-11 21:46:38.235489+00
0f8edc8a-f959-4edd-a922-01e573bf7d45;real_estate;"[""hero"",""featured_properties"",""search"",""about"",""testimonials"",""contact""]";[];High-quality property photos, emphasize local market expertise, highlight success stories;"[""Browse Listings"",""Schedule a Showing"",""Get Home Value"",""Contact Agent""]";"[""property_inquiry"",""home_valuation"",""contact_form""]";2025-11-11 21:46:38.235489+00;2025-11-11 21:46:38.235489+00